{
  "architectApproval": {
    "approvedAt": "2026-08-10T22:22:51.127Z",
    "approvedTargetIds": [
      "PG-024",
      "PG-029",
      "PG-047",
      "PG-052",
      "PG-053",
      "PG-056"
    ],
    "decision": "APPROVE",
    "evidenceSha256": "5f03cbcaf9a123d2e3ba4b57abc749c2952fa34848f667d2b17050fafb56cd32",
    "outputSha256": "d229c780d09d6317af7116edd94b34868cd95687aeb2a2365f1d175e923c076e",
    "publicSignature": {
      "algorithm": "Ed25519",
      "authorityFingerprint": "423f474c59667e5eabc13a703b8d7de4e97bcba33cdc22340873866db9d6a53f",
      "signatureBase64": "4CAW1K9HaZYYHJhJbkO+n8lbXGe/raHDVYEgBD92ETpmx+cblDi9o0qyb1Z515bCEjgmjA3uyUgtczBTzTf4Bw=="
    },
    "reviewerId": "architect-reviewer-g002-v2-20260810",
    "schemaVersion": "g002-v2-canonical-architect-approval-v1",
    "source": "independent-architect-review"
  },
  "baseAuthority": {
    "canonicalContractFileSha256": "ede8e2a728c588cafc4f614e7858495f138cf7b208b7048166b66610fd5c6de1",
    "canonicalContractOutputSha256": "8588703a71b4f02411d876eaf4a276d1e0836706fab3428de2509b3849571def",
    "canonicalContractPath": "production/reports/biological-continuity-v3/g002-evidence-v1/canonical-root-redesign-targets-v1.json",
    "publicManifestFileSha256": "ea86e51a1fc21eaaad708e256bf3348480fa284d201814ec71f89fec128889af",
    "publicManifestOutputSha256": "5b29298aaf917955ac8f094552948ee4093be363a478e92d987fc5b13d88e01c",
    "publicManifestPath": "production/reports/biological-continuity-v3/g002-evidence-v1/public-evidence-manifest.json"
  },
  "contractKind": "ADDITIVE_CANONICAL_ROOT_AUTHORITY_SUCCESSOR",
  "newTargetIds": [
    "PG-024",
    "PG-029",
    "PG-047",
    "PG-052",
    "PG-053",
    "PG-056"
  ],
  "outputSha256": "6cee5fa6c9c28d5801eac5df8696c3857787ddf4597035194c749be37aac6168",
  "publicSignature": {
    "algorithm": "Ed25519",
    "authorityFingerprint": "423f474c59667e5eabc13a703b8d7de4e97bcba33cdc22340873866db9d6a53f",
    "signatureBase64": "afoD/wxeerdqYW5pe8ptxroXH5p2fetgv9eWRyQaKVqKk3ycOXbre8/Ak0EjjPRz5rzL7eNgeaOKZFcPCRQzBA=="
  },
  "reviewProofs": [
    {
      "consensusSha256": "f154aeeaf92b76004a127f90b391953e4f1f360a255aa74df3cb25d7d5d7c8bf",
      "primaryReviews": [
        {
          "agentTaskId": "/root/g002_v2_blind_pass1",
          "assignmentSha256": "f916554de4ffe6c056df6834697f7197e4ffac98b92a944d11dbdbc57efb936f",
          "blinded": true,
          "inputAllowlistSha256": "e8c8fd5df6b0fd1ac5cd07dccc4522bcb92d605fca0bfb3e5d07f7e72afe6008",
          "materialBindingSha256": "358c90c1bb8873a040346943be230aa93fdfadf5a8e54407c98f7377c54515e6",
          "observedSurfaces": {
            "masterSha256": "11b803d6b3753acab20121b7e526019c67d314740d3b200ccbd423de4c6ea813",
            "runtimeSha256": "f25b54f74670c372159714affac8b76097fb7b25d52d9c0bc76df98f1ef28959"
          },
          "packageManifestSha256": "3a028000e2a6a08637d7df5e1571e1e4afbaf46249ff918836750ad4121b2ca4",
          "passNumber": 1,
          "promptSha256": "f14d24ab249b9aca74c3921cc6fc90c12e9ec7f44f67366516285d42d1c0f0ab",
          "rawVoteSha256": "5fcd54326a07dc98c48b4ec9a264529bb7efb49e1d6cea54b263f14571bc2973",
          "reviewOutputSha256": "719e2d7ed638d5f750b97c891114d43746f2c31a782e3c5e0d7628d16d52e210",
          "reviewRunId": "g002-v2-canonical-pass-1-20260810",
          "reviewerInstanceId": "blind-primary-reviewer-1-20260810",
          "verdicts": {
            "anchors": "PASS",
            "clarifications": "PASS",
            "target": "PASS",
            "visibility": "PASS"
          }
        },
        {
          "agentTaskId": "/root/g002_v2_blind_pass2",
          "assignmentSha256": "134b1020bd2c43a9f704fd8271f12d11bde3eb1ab910d57e25ee08a18721e633",
          "blinded": true,
          "inputAllowlistSha256": "e8c8fd5df6b0fd1ac5cd07dccc4522bcb92d605fca0bfb3e5d07f7e72afe6008",
          "materialBindingSha256": "358c90c1bb8873a040346943be230aa93fdfadf5a8e54407c98f7377c54515e6",
          "observedSurfaces": {
            "masterSha256": "11b803d6b3753acab20121b7e526019c67d314740d3b200ccbd423de4c6ea813",
            "runtimeSha256": "f25b54f74670c372159714affac8b76097fb7b25d52d9c0bc76df98f1ef28959"
          },
          "packageManifestSha256": "3a028000e2a6a08637d7df5e1571e1e4afbaf46249ff918836750ad4121b2ca4",
          "passNumber": 2,
          "promptSha256": "f14d24ab249b9aca74c3921cc6fc90c12e9ec7f44f67366516285d42d1c0f0ab",
          "rawVoteSha256": "fe803ac501d1cbb8d9f948a14607cf773ff40a1e8b6de2db628ff6bab0f78c71",
          "reviewOutputSha256": "4aedbf38b284b4bc61dea23d4460f819ef20ad16a0786107c869d5ed403b488f",
          "reviewRunId": "g002-v2-canonical-pass-2-20260810",
          "reviewerInstanceId": "blind-primary-reviewer-2-20260810",
          "verdicts": {
            "anchors": "PASS",
            "clarifications": "PASS",
            "target": "PASS",
            "visibility": "PASS"
          }
        }
      ],
      "publicProofFileSha256": "b97ea830849571943bdca13a3181b34f1f0cca9c4300c4a2a727955cf50b165f",
      "publicProofOutputSha256": "1c4bc2641d32005bd6afcc6f9ce652dab2693c1f80eb904f8bd0c7d5f75d281c",
      "publicProofPath": "production/reports/biological-continuity-v3/g002-evidence-v2/canonical-root-reviews/proofs/PG-024.json",
      "publicProofSignatureSha256": "42b4fd28ee1e0d0b250ffa819d277aa3f91814c3ef5147688311829217a3e0b2",
      "rootId": "PG-024",
      "targetSha256": "de05fc777316c2f97714969f72ed20b72184fafe5bc19667667cbf27157e0101"
    },
    {
      "consensusSha256": "c29227bc2baf234a2d84100380d22210e287b4582a8a7ba8a5029d778d628c24",
      "primaryReviews": [
        {
          "agentTaskId": "/root/g002_v2_blind_pass1",
          "assignmentSha256": "b1fb74ea42922cc080781f0dfb01c310e7e6dee205360f5a47af9a43640c1d9c",
          "blinded": true,
          "inputAllowlistSha256": "47a034d2296e20034c378b9709424f9c215f3f52cd9437d45b2d7ab90215289c",
          "materialBindingSha256": "92dfa494ca153117cb8acdd1c96c1ded13eaa222f254ffd3dbcfbf8e3d799c40",
          "observedSurfaces": {
            "masterSha256": "5f463145a5811b4731c102b721d3ff1355ecd1e29f8b124147ede22f465548d9",
            "runtimeSha256": "cb061e0b12bc962c024a53cd8903b425ccd1deb74728842c09a9d9d82df6e9b2"
          },
          "packageManifestSha256": "6a5db04e1f8a41c9462ce9430ad3937eed4ab795eaead9bf66133eca2d4d3906",
          "passNumber": 1,
          "promptSha256": "5fecf89de7885e5bb4fc6d843d051da5f214b6538242308e002cbca0f8bf6336",
          "rawVoteSha256": "b912a2c6710410b9931a8b3f8f723521fdd61df524051497493f23e1a35a70df",
          "reviewOutputSha256": "234c91e3c5057ffbf85c1d48978efbea6f5bc526dff442bb691c893567545049",
          "reviewRunId": "g002-v2-canonical-pass-1-20260810",
          "reviewerInstanceId": "blind-primary-reviewer-1-20260810",
          "verdicts": {
            "anchors": "PASS",
            "clarifications": "PASS",
            "target": "PASS",
            "visibility": "PASS"
          }
        },
        {
          "agentTaskId": "/root/g002_v2_blind_pass2",
          "assignmentSha256": "c02fb9c171b77dc2a51678197b75215da4c9110894638964abcdce441483e93c",
          "blinded": true,
          "inputAllowlistSha256": "47a034d2296e20034c378b9709424f9c215f3f52cd9437d45b2d7ab90215289c",
          "materialBindingSha256": "92dfa494ca153117cb8acdd1c96c1ded13eaa222f254ffd3dbcfbf8e3d799c40",
          "observedSurfaces": {
            "masterSha256": "5f463145a5811b4731c102b721d3ff1355ecd1e29f8b124147ede22f465548d9",
            "runtimeSha256": "cb061e0b12bc962c024a53cd8903b425ccd1deb74728842c09a9d9d82df6e9b2"
          },
          "packageManifestSha256": "6a5db04e1f8a41c9462ce9430ad3937eed4ab795eaead9bf66133eca2d4d3906",
          "passNumber": 2,
          "promptSha256": "5fecf89de7885e5bb4fc6d843d051da5f214b6538242308e002cbca0f8bf6336",
          "rawVoteSha256": "b2a2c4453596ba92ef728ae4634b10903b56e2827ab3a7edb26bcbbf98e9264f",
          "reviewOutputSha256": "dc2f38145be827e2299ed0b92b5b3a4ca9884663071830482217834303e34da5",
          "reviewRunId": "g002-v2-canonical-pass-2-20260810",
          "reviewerInstanceId": "blind-primary-reviewer-2-20260810",
          "verdicts": {
            "anchors": "PASS",
            "clarifications": "PASS",
            "target": "PASS",
            "visibility": "PASS"
          }
        }
      ],
      "publicProofFileSha256": "0f28a21ea56444038c09f3bddcb2bff96c06634b225e8a371185fc1949d29613",
      "publicProofOutputSha256": "1ede4e41ef406754640adad90d7a37c37344ce902ac25f89ef700185c8d2bb63",
      "publicProofPath": "production/reports/biological-continuity-v3/g002-evidence-v2/canonical-root-reviews/proofs/PG-029.json",
      "publicProofSignatureSha256": "3c6ffbf7fcd3882f2c206bab2bb8bdd338446c565f49d8c7fea37c5342d06b08",
      "rootId": "PG-029",
      "targetSha256": "a5c0ad2121e5c75f5fbe8bf3b7f8b2c12df3d1f59214d3c3620b591c20d9a35c"
    },
    {
      "consensusSha256": "75d4c9d05794ce026a5ad7e37e7a154336fba4fb34055b8055a98efce8a7d5a7",
      "primaryReviews": [
        {
          "agentTaskId": "/root/g002_v2_blind_pass1",
          "assignmentSha256": "f7634b8bba4c0fe9718057621ef7082a88027b53038d0e98076e790cbaaa5dec",
          "blinded": true,
          "inputAllowlistSha256": "541a847afbd95ada73ef0f1a81ae93527704f34b72ca1a21e90a5e527fad9389",
          "materialBindingSha256": "f47533fa6ab5eb9b765958c795971179b3f6860b48e2fcffbe3fcefd9dc19480",
          "observedSurfaces": {
            "masterSha256": "ac83871f515f8f86cad1e4aad4e04e2c2f68dbf48dfe1c23a174360c7f78708d",
            "runtimeSha256": "739ba658d647ef33585115bd181fab5335b45a9ec648738cfdc431d4c31a6501"
          },
          "packageManifestSha256": "129c900f86a28d45e2e70eceee4b392aa6de2475e40c030a9fcdaa0ee42f5fc6",
          "passNumber": 1,
          "promptSha256": "0ffa13fe7e43a2d0b203fd5f97f8249d98725ceefdfeabc4c4d5c2d127a23297",
          "rawVoteSha256": "6b0ed6f780278fa0030c9a9ee30edae3595649533bb645918c93de953f00660b",